{
  "$schema": "https://json-schema.org/draft/2020-12/schema",
  "$id": "https://onderstad.local/schemas/room.schema.json",
  "title": "Onderstad: kamer (content/chapters/<chNN_naam>/rooms/<kamer_id>.json)",
  "description": "Eén kamer: begin-plek van objecten (de objectboom), uitgangen met toegang, NPC's, en wat de 3D-weergave nodig heeft (vakken, camera, lichten, model). Bestandsnaam = id. De kamerweergave bouwt de 3D-scène uit dit bestand; een eventuele handgemaakte aanvulling staat in game/scenes/rooms/<hoofdstuk>/<id>.tscn. Zie docs/systemen/kamerweergave.md, objecten-en-inventaris.md en toegang.md.",
  "type": "object",
  "required": ["id", "naam", "soort", "afmeting", "objecten", "uitgangen"],
  "properties": {
    "$schema": { "type": "string" },
    "id": { "$ref": "common.schema.json#/$defs/kamer_id" },
    "naam": { "$ref": "common.schema.json#/$defs/tekstsleutel" },
    "beschrijving": {
      "description": "Wat 'bekijk' op een lege plek toont.",
      "$ref": "common.schema.json#/$defs/tekstvariant"
    },
    "soort": {
      "description": "binnen/buiten bepaalt later o.a. regen en drogen; droom is voor het droomsysteem (later).",
      "enum": ["binnen", "buiten", "droom"]
    },
    "afmeting": {
      "description": "Vloer in vakken van 1x1 m: breedte = kolommen langs X, hoogte = rijen in de diepte langs Z (niet omhoog). Richtwaarde 4x5 tot 10x8, open ruimte hooguit 24x14. Zie docs/systemen/kamerweergave.md.",
      "type": "object",
      "required": ["breedte", "hoogte"],
      "properties": {
        "breedte": { "type": "integer", "minimum": 1, "maximum": 64 },
        "hoogte": { "type": "integer", "minimum": 1, "maximum": 64 }
      },
      "additionalProperties": false
    },
    "start_positie": {
      "description": "Waar de speler verschijnt zonder uitgang (hoofdstukstart, naar_kamer zonder uitgang).",
      "$ref": "common.schema.json#/$defs/positie"
    },
    "plafond": {
      "description": "Hoogte van muren en plafond in m (alleen weergave). Standaard 2,6 binnen; buiten en droom zonder plafond.",
      "type": "number",
      "minimum": 2.0,
      "maximum": 12.0
    },
    "model": {
      "description": "Kamermodel (.glb) onder game/assets/. Afwezig of niet gevonden = placeholder uit afmeting, plafond en geblokkeerd. Alleen weergave; logica leest het nooit.",
      "$ref": "common.schema.json#/$defs/asset_id"
    },
    "camera": {
      "description": "Vaste camera van deze kamer. Afwezige velden krijgen de standaard. Kamers van één gebouw horen dezelfde kanteling en draaiing te hebben (stijlgids 3.1).",
      "type": "object",
      "properties": {
        "kanteling": { "description": "Graden omlaag.", "type": "number", "minimum": 35, "maximum": 41, "default": 38 },
        "draaiing": {
          "description": "Graden om de verticale as; positief = camera rechtsvoor, negatief = linksvoor.",
          "type": "number",
          "oneOf": [ { "minimum": 20, "maximum": 35 }, { "minimum": -35, "maximum": -20 } ],
          "default": 27
        },
        "fov": { "description": "Verticale FOV in graden.", "type": "number", "minimum": 15, "maximum": 20, "default": 17 },
        "afstand": { "description": "Afstand in m tot het kamermidden. Afwezig = automatisch passend (kamerweergave.md, W11).", "type": "number", "minimum": 10, "maximum": 200 },
        "volgt": { "description": "Alleen buitenruimtes groter dan het eiland: camera schuift mee met Richard.", "type": "boolean", "default": false }
      },
      "additionalProperties": false
    },
    "geblokkeerd": {
      "description": "Vakken waar niemand kan staan of iets kan liggen, naast uitgangen, objecten en NPC's: decor zoals bed, bureau, pilaar. Mag een vak met een niet-pakbaar object overlappen (laptop op een bureau).",
      "type": "array",
      "items": { "$ref": "common.schema.json#/$defs/vakgebied" }
    },
    "lichten": {
      "description": "Vaste lichtbronnen van de kamer (lampen, raamlicht). Ambient, randlicht en levende bronnen komen hier niet in. Budget: kamerweergave.md, W8 en W22.",
      "type": "array",
      "maxItems": 16,
      "items": { "$ref": "#/$defs/licht" }
    },
    "gebouw": {
      "description": "Gebouw-id uit chapter.json (gebouwen).",
      "$ref": "common.schema.json#/$defs/id"
    },
    "niveau": {
      "description": "Toegangsniveau van deze kamer, als <gebouw>.<niveau>. Informatief en voor het liftpaneel; toegang zelf staat in 'vereist' van de uitgangen.",
      "$ref": "common.schema.json#/$defs/niveau_ref"
    },
    "neerleggen": {
      "description": "Mag de speler hier objecten neerleggen? (false voor bijv. droomkamers en rijdende voertuigen.)",
      "type": "boolean",
      "default": true
    },
    "vloer": {
      "description": "Vloermateriaal. Gereserveerd voor voetsporen en voetstap-cues (later).",
      "enum": ["tegel", "linoleum", "tapijt", "beton", "hout", "laminaat", "klinkers", "asfalt", "grind", "metaal", "gras"]
    },
    "galm": {
      "description": "Ruimteklank voor het geluidsvenster en later de mix.",
      "enum": ["klein", "middel", "groot", "buiten"]
    },
    "ambience": {
      "description": "Doorlopende cues die starten bij binnenkomst en stoppen bij vertrek.",
      "type": "array",
      "uniqueItems": true,
      "items": { "$ref": "common.schema.json#/$defs/cue_id" }
    },
    "objecten": {
      "description": "Begin-objectboom: objecten op de vloer van deze kamer, met hun inhoud.",
      "type": "array",
      "items": { "$ref": "#/$defs/plaatsing" }
    },
    "uitgangen": {
      "type": "array",
      "items": { "$ref": "#/$defs/uitgang" }
    },
    "npcs": {
      "type": "array",
      "items": { "$ref": "#/$defs/npc" }
    },
    "notitie": { "type": "string", "description": "Ontwerpnotitie, niet spelerszichtbaar." }
  },
  "additionalProperties": false,
  "$defs": {
    "plaatsing": {
      "type": "object",
      "required": ["object", "positie"],
      "properties": {
        "object": { "$ref": "common.schema.json#/$defs/item_id" },
        "positie": { "$ref": "common.schema.json#/$defs/positie" },
        "stand": { "$ref": "#/$defs/stand" },
        "inhoud": {
          "type": "array",
          "items": { "$ref": "#/$defs/inhoud" }
        }
      },
      "additionalProperties": false
    },
    "stand": {
      "description": "Alleen weergave: waar het model binnen zijn vak staat. De logica kent alleen het vak.",
      "type": "object",
      "properties": {
        "dx": { "description": "Verschuiving in m langs X vanaf het vakmidden.", "type": "number", "minimum": -0.5, "maximum": 0.5, "default": 0 },
        "dz": { "description": "Verschuiving in m langs Z vanaf het vakmidden.", "type": "number", "minimum": -0.5, "maximum": 0.5, "default": 0 },
        "hoogte": { "description": "Hoogte van het voetpunt boven de vloer in m (bijv. 0,75 op een bureau).", "type": "number", "minimum": 0, "maximum": 3, "default": 0 },
        "draai": { "description": "Graden om de verticale as; 0 = voorkant naar de camerakant (+Z).", "type": "number", "minimum": 0, "maximum": 359, "default": 0 }
      },
      "additionalProperties": false
    },
    "licht": {
      "type": "object",
      "required": ["id", "soort", "positie", "kleur", "energie"],
      "properties": {
        "id": { "description": "Uniek binnen de kamer.", "$ref": "common.schema.json#/$defs/id" },
        "soort": { "description": "punt = OmniLight3D; spot = SpotLight3D die recht omlaag schijnt.", "enum": ["punt", "spot"] },
        "positie": { "$ref": "common.schema.json#/$defs/positie" },
        "hoogte": { "description": "Hoogte boven de vloer in m. Standaard 0,2 onder het plafond.", "type": "number", "minimum": 0, "maximum": 12 },
        "kleur": { "$ref": "common.schema.json#/$defs/kleur" },
        "energie": { "type": "number", "minimum": 0, "maximum": 16 },
        "bereik": { "description": "Bereik in m.", "type": "number", "minimum": 0.5, "maximum": 30, "default": 5 },
        "kegel": { "description": "Alleen spot: openingshoek in graden.", "type": "number", "minimum": 5, "maximum": 90, "default": 60 },
        "schaduw": { "description": "Werpt schaduw. Hoogstens 6 per kamer; de lichte stand houdt de eerste 3 (volgorde in deze lijst = belang).", "type": "boolean", "default": false }
      },
      "additionalProperties": false
    },
    "inhoud": {
      "description": "Object in een container; geen positie.",
      "type": "object",
      "required": ["object"],
      "properties": {
        "object": { "$ref": "common.schema.json#/$defs/item_id" },
        "inhoud": {
          "type": "array",
          "items": { "$ref": "#/$defs/inhoud" }
        }
      },
      "additionalProperties": false
    },
    "doorgang": {
      "type": "object",
      "required": ["naar_kamer", "naar_uitgang"],
      "properties": {
        "naar_kamer": { "$ref": "common.schema.json#/$defs/kamer_id" },
        "naar_uitgang": {
          "description": "Id van de uitgang in de doelkamer waar de speler verschijnt.",
          "$ref": "common.schema.json#/$defs/id"
        },
        "label": {
          "description": "Knoptekst op het liftpaneel (alleen bij bestemmingen).",
          "$ref": "common.schema.json#/$defs/tekstsleutel"
        },
        "vereist": { "$ref": "common.schema.json#/$defs/conditie" },
        "geweigerd": { "$ref": "common.schema.json#/$defs/tekstsleutel" },
        "naar_scene": {
          "description": "Deze doorgang kost tijd: de klok springt naar deze scène.",
          "$ref": "common.schema.json#/$defs/scene_id"
        }
      },
      "additionalProperties": false
    },
    "uitgang": {
      "description": "Een kant van een deur, trap, lift, poort, hek of slagboom. Heeft óf naar_kamer/naar_uitgang óf bestemmingen (lift).",
      "type": "object",
      "required": ["id", "type", "positie"],
      "properties": {
        "id": { "$ref": "common.schema.json#/$defs/id" },
        "type": { "enum": ["deur", "doorgang", "trap", "lift", "poort", "hek", "slagboom", "raam", "luik"] },
        "positie": { "$ref": "common.schema.json#/$defs/positie" },
        "naam": { "$ref": "common.schema.json#/$defs/tekstsleutel" },
        "beschrijving": { "$ref": "common.schema.json#/$defs/tekstvariant" },
        "naar_kamer": { "$ref": "common.schema.json#/$defs/kamer_id" },
        "naar_uitgang": { "$ref": "common.schema.json#/$defs/id" },
        "vereist": {
          "description": "Toegangsregel voor doorgaan vanaf deze kant. Afwezig = vrij.",
          "$ref": "common.schema.json#/$defs/conditie"
        },
        "geweigerd": {
          "description": "Mompel of beschrijving als vereist niet klopt.",
          "$ref": "common.schema.json#/$defs/tekstvariant"
        },
        "naar_scene": {
          "description": "Doorgaan kost tijd: de klok springt naar deze scène.",
          "$ref": "common.schema.json#/$defs/scene_id"
        },
        "bestemmingen": {
          "description": "Alleen voor lift: knoppen op het paneel.",
          "type": "array",
          "minItems": 1,
          "items": { "$ref": "#/$defs/doorgang" }
        },
        "geluid": {
          "type": "object",
          "properties": {
            "open": { "$ref": "common.schema.json#/$defs/cue_id" },
            "geweigerd": { "$ref": "common.schema.json#/$defs/cue_id" }
          },
          "additionalProperties": false
        }
      },
      "additionalProperties": false,
      "oneOf": [
        { "required": ["naar_kamer", "naar_uitgang"], "not": { "required": ["bestemmingen"] } },
        { "required": ["bestemmingen"], "properties": { "type": { "const": "lift" } }, "not": { "anyOf": [ { "required": ["naar_kamer"] }, { "required": ["naar_uitgang"] } ] } }
      ]
    },
    "npc": {
      "type": "object",
      "required": ["id", "personage", "positie"],
      "properties": {
        "id": {
          "description": "Uniek binnen de kamer.",
          "$ref": "common.schema.json#/$defs/id"
        },
        "personage": { "$ref": "common.schema.json#/$defs/personage_id" },
        "positie": { "$ref": "common.schema.json#/$defs/positie" },
        "aanwezig": {
          "description": "Wanneer de NPC hier is (bijv. niet tijdens een pauze-gebeurtenis). Afwezig = altijd.",
          "$ref": "common.schema.json#/$defs/conditie"
        },
        "bekijk": { "$ref": "common.schema.json#/$defs/tekstvariant" },
        "gesprekken": {
          "description": "Eerste gesprek waarvan 'als' klopt start bij aanklikken.",
          "type": "array",
          "items": {
            "type": "object",
            "required": ["dialoog"],
            "properties": {
              "als": { "$ref": "common.schema.json#/$defs/conditie" },
              "dialoog": { "$ref": "common.schema.json#/$defs/dialoog_id" }
            },
            "additionalProperties": false
          }
        },
        "geluid": {
          "description": "Doorlopende cue van deze NPC zolang hij aanwezig is (bijv. radio, hoesten).",
          "$ref": "common.schema.json#/$defs/cue_id"
        }
      },
      "additionalProperties": false
    }
  }
}
