{
  "id": "ch01_dak",
  "naam": "kamer.ch01_dak.naam",
  "beschrijving": "kamer.ch01_dak.beschrijving",
  "soort": "buiten",
  "afmeting": { "breedte": 10, "hoogte": 6 },
  "start_positie": { "x": 4, "y": 3 },
  "gebouw": "proef",
  "niveau": "proef.dak",
  "neerleggen": false,
  "vloer": "beton",
  "galm": "buiten",
  "objecten": [
    { "object": "kopje_blauw", "positie": { "x": 3, "y": 3 } }
  ],
  "uitgangen": [
    {
      "id": "lift_dak", "type": "lift", "positie": { "x": 2, "y": 2 },
      "naam": "uitgang.ch01_dak.lift_dak.naam",
      "bestemmingen": [
        { "naar_kamer": "ch01_hal", "naar_uitgang": "lift_hal", "label": "uitgang.ch01_dak.lift_dak.hal" },
        {
          "naar_kamer": "ch01_kantoor", "naar_uitgang": "lift_kantoor",
          "label": "uitgang.ch01_dak.lift_dak.kantoor",
          "vereist": { "niveau": "proef.kantoor" }
        }
      ]
    }
  ]
}
