{
  "id": "ch01_kantoor",
  "naam": "kamer.ch01_kantoor.naam",
  "beschrijving": "kamer.ch01_kantoor.beschrijving",
  "soort": "binnen",
  "afmeting": {
    "breedte": 8,
    "hoogte": 6
  },
  "start_positie": {
    "x": 1,
    "y": 3
  },
  "gebouw": "proef",
  "niveau": "proef.kantoor",
  "vloer": "linoleum",
  "galm": "klein",
  "plafond": 2.6,
  "camera": {
    "kanteling": 38,
    "draaiing": 27,
    "fov": 17
  },
  "geblokkeerd": [
    {
      "x": 3,
      "y": 1,
      "breedte": 2,
      "hoogte": 1
    }
  ],
  "lichten": [
    {
      "id": "tl_plafond",
      "soort": "spot",
      "positie": {
        "x": 3,
        "y": 3
      },
      "hoogte": 2.5,
      "kleur": "#F0F6F0",
      "energie": 2.0,
      "bereik": 6,
      "kegel": 80,
      "schaduw": true
    },
    {
      "id": "bureaulamp",
      "soort": "punt",
      "positie": {
        "x": 3,
        "y": 1
      },
      "hoogte": 1.1,
      "kleur": "#FFD8A0",
      "energie": 1.2,
      "bereik": 3,
      "schaduw": true
    }
  ],
  "objecten": [
    {
      "object": "kluisje",
      "positie": {
        "x": 6,
        "y": 1
      },
      "inhoud": [
        {
          "object": "rapport"
        }
      ]
    },
    {
      "object": "laptop",
      "positie": {
        "x": 4,
        "y": 1
      },
      "stand": {
        "hoogte": 0.75
      }
    },
    {
      "object": "prullenbak",
      "positie": {
        "x": 6,
        "y": 4
      }
    }
  ],
  "uitgangen": [
    {
      "id": "deur_hal",
      "type": "deur",
      "positie": {
        "x": 0,
        "y": 3
      },
      "naam": "uitgang.ch01_kantoor.deur_hal.naam",
      "naar_kamer": "ch01_hal",
      "naar_uitgang": "bestaat_niet"
    },
    {
      "id": "lift_kantoor",
      "type": "lift",
      "positie": {
        "x": 7,
        "y": 3
      },
      "naam": "uitgang.ch01_kantoor.lift_kantoor.naam",
      "bestemmingen": [
        {
          "naar_kamer": "ch01_hal",
          "naar_uitgang": "lift_hal",
          "label": "uitgang.ch01_kantoor.lift_kantoor.hal"
        },
        {
          "naar_kamer": "ch01_dak",
          "naar_uitgang": "lift_dak",
          "label": "uitgang.ch01_kantoor.lift_kantoor.dak",
          "vereist": {
            "token": "kantoorkennis"
          },
          "geweigerd": "uitgang.ch01_hal.lift_hal.geweigerd"
        }
      ]
    }
  ]
}
